{
  "engine": "qwen",
  "provider_contract": {
    "multi_provider": true,
    "canonical_provider_id": null
  },
  "prompt_builder": {
    "skill_invoke_line_template": "Invoke skill named {{ skill.id }}",
    "body_prefix_extra_block": "",
    "body_suffix_extra_block": ""
  },
  "session_codec": {
    "strategy": "json_lines_scan",
    "error_message": "SESSION_RESUME_FAILED: missing session id",
    "error_prefix": "SESSION_RESUME_FAILED: qwen",
    "required_type": null,
    "id_field": null,
    "recursive_key": null,
    "fallback_text_finder": null,
    "json_lines_finder": "find_session_id",
    "regex_pattern": null
  },
  "attempt_workspace": {
    "workspace_subdir": ".qwen",
    "skills_subdir": "skills",
    "use_config_parent_as_workspace": false,
    "unknown_fallback": false
  },
  "launch": {
    "cwd_strategy": "run_dir",
    "config_env_var": null,
    "run_dir_flag": null
  },
  "config_assets": {
    "bootstrap_path": "../config/bootstrap.json",
    "default_path": "../config/default.json",
    "enforced_path": "../config/enforced.json",
    "settings_schema_path": "../schemas/qwen_config_schema.json",
    "skill_defaults_path": "assets/qwen_config.json"
  },
  "model_catalog": {
    "mode": "manifest",
    "manifest_path": "../models/manifest.json",
    "models_root": "../models",
    "seed_path": null
  },
  "command_defaults": {
    "start": [
      "--output-format", "stream-json",
      "--approval-mode", "yolo",
      "-p"
    ],
    "resume": [
      "--output-format", "stream-json",
      "--approval-mode", "yolo",
      "--resume"
    ],
    "ui_shell": []
  },
  "structured_output": {
    "mode": "noop",
    "cli_schema_strategy": "noop",
    "compat_schema_strategy": "noop",
    "prompt_contract_strategy": "canonical_summary",
    "payload_canonicalizer": "noop"
  },
  "ui_shell": {
    "command_id": "qwen-tui",
    "label": "Qwen TUI",
    "trust_bootstrap_parent": false,
    "sandbox_arg": null,
    "retry_without_sandbox_on_early_exit": false,
    "sandbox_probe_strategy": "static_unsupported",
    "sandbox_probe_message": "Qwen Code TUI runs without sandbox by default.",
    "auth_hint_strategy": "none",
    "runtime_override_strategy": "none",
    "config_assets": {
      "default_path": "../config/ui_shell_default.json",
      "enforced_path": "../config/ui_shell_enforced.json",
      "settings_schema_path": "../schemas/qwen_config_schema.json",
      "target_relpath": ".qwen/settings.json"
    }
  },
  "cli_management": {
    "package": "@qwen-code/qwen-code",
    "binary_candidates": ["qwen", "qwen.cmd", "qwen.exe"],
    "credential_imports": [
      {
        "source": "oauth_creds.json",
        "target_relpath": ".qwen/oauth_creds.json",
        "import_validator": "qwen_oauth_creds_json"
      }
    ],
    "credential_policy": {
      "mode": "any_of_sources",
      "sources": ["oauth_creds.json"],
      "settings_validator": null
    },
    "resume_probe": {
      "help_hints": ["--resume"],
      "dynamic_args": []
    },
    "layout": {
      "extra_dirs": [".qwen"],
      "bootstrap_target_relpath": ".qwen/settings.json",
      "bootstrap_format": "json",
      "normalize_strategy": null
    }
  },
  "parser_auth_patterns": {
    "rules": [
      {
        "id": "qwen_oauth_waiting_authorization",
        "enabled": true,
        "priority": 950,
        "match": {
          "all": [
            {
              "field": "combined_text",
              "op": "regex",
              "value": "Qwen OAuth Device Authorization|https://chat\\.qwen\\.ai/authorize\\?user_code="
            },
            {
              "field": "combined_text",
              "op": "regex",
              "value": "Waiting for authorization to complete"
            }
          ]
        }
      },
      {
        "id": "qwen_oauth_token_expired",
        "enabled": true,
        "priority": 900,
        "match": {
          "all": [
            {
              "field": "combined_text",
              "op": "regex",
              "value": "OAuth.*token.*expired|401.*Unauthorized|invalid.*token"
            }
          ]
        }
      },
      {
        "id": "qwen_api_key_missing",
        "enabled": true,
        "priority": 890,
        "match": {
          "all": [
            {
              "field": "combined_text",
              "op": "regex",
              "value": "API key is missing|Invalid API key|Missing.*authentication"
            }
          ]
        }
      },
      {
        "id": "qwen_coding_plan_error",
        "enabled": true,
        "priority": 880,
        "match": {
          "all": [
            {
              "field": "combined_text",
              "op": "regex",
              "value": "Coding Plan.*error|subscription.*expired|quota.*exceeded"
            }
          ]
        }
      }
    ]
  }
}
